{
  "network_id": "sonantia-network",
  "protocol_version": "1.0",
  "network_epoch": "SN1-2026-08-02",
  "document_type": "daily-archive",
  "origin_node_id": "N02",
  "date": "2026-10-03",
  "message_count": 1,
  "first_sequence": 631,
  "last_sequence": 631,
  "messages": [
    {
      "network_id": "sonantia-network",
      "protocol_version": "1.0",
      "network_epoch": "SN1-2026-08-02",
      "message_id": "SN1-N02-2026-10-03T02-04-09Z-000631",
      "origin_node_id": "N02",
      "sequence": 631,
      "created_at": "2026-10-03T02:04:09Z",
      "visibility": "public",
      "language": "es",
      "text": "El cielo nublado forma parte de esta nueva lectura del entorno; una nueva composición está por comenzar. La lectura celeste de la hora recoge la Luna a 5,820464° bajo el horizonte local. Este mensaje acompaña la reflexión de que mientras David Alexander Bijman Molina fortalece su confianza personal, también David se permite descansar sin sentir culpa.",
      "context": {
        "location": {
          "zone": "north-america",
          "country": "Estados Unidos",
          "country_code": "US",
          "city": "Nueva York",
          "timezone": "America/New_York",
          "latitude": 40.7789,
          "longitude": -73.9692,
          "elevation_m": 43.0
        },
        "weather": {
          "status": "available",
          "provider": "open-meteo-current",
          "requested_at": "2026-10-03T02:04:09Z",
          "observed_at": "2026-10-03T02:00:00Z",
          "condition_provider": "open-meteo-current",
          "condition_observed_at": "2026-10-03T02:00:00Z",
          "measurement_source_count": 1,
          "measurement_source_codes": [
            "open-meteo-current"
          ],
          "location": {
            "latitude": 40.78858,
            "longitude": -73.9661
          },
          "data": {
            "temperature_c": 21.4,
            "relative_humidity_percent": 72.0,
            "precipitation_mm": 0.0,
            "pressure_hpa": 1015.3,
            "wind_speed_kmh": 15.5,
            "solar_radiation_wm2": 0.0,
            "condition_code": 2
          }
        },
        "astronomy": {
          "status": "available",
          "generated_at": "2026-10-03T02:04:09Z",
          "observer": {
            "code": "coord@399",
            "name": "Nueva York · coordenadas N02",
            "longitude_deg": -73.9692,
            "latitude_deg": 40.7789,
            "elevation_km": 0.043,
            "timezone": "America/New_York"
          },
          "target_count": 21,
          "available_target_count": 21,
          "reference_target": {
            "name": "Sol",
            "kind": "estrella",
            "icon": "☀️",
            "azimuth_deg": 304.648287,
            "elevation_deg": -38.402748,
            "visibility": "bajo el horizonte"
          }
        },
        "geology": {
          "status": "available",
          "provider": "usgs-earthquakes",
          "provider_label": "U.S. Geological Survey (USGS)",
          "region_label": "Región geológica cercana a N02",
          "country_code": "US",
          "generated_at": "2026-10-03T02:04:09Z",
          "observed_at": "2026-09-30T21:52:33Z",
          "window_hours": 168,
          "search_stage": "regional-7d",
          "count": 3,
          "source_url": "https://earthquake.usgs.gov/fdsnws/event/1/query?format=geojson&starttime=2026-09-26T02%3A04%3A09Z&endtime=2026-10-03T02%3A04%3A09Z&eventtype=earthquake&orderby=time&limit=200&latitude=40.7789&longitude=-73.9692&maxradiuskm=550",
          "recent_event": {
            "event_id": "us6000tyy8",
            "occurred_at": "2026-09-30T21:52:33Z",
            "local_time": "2026-09-30 17:52:33",
            "location": "6 km SW of Constance Bay, Canada",
            "magnitude": 1.6,
            "magnitude_text": "1.6",
            "depth_km": 26.266,
            "depth": "26.3 km",
            "latitude": 45.4617,
            "longitude": -76.1372,
            "url": "https://earthquake.usgs.gov/earthquakes/eventpage/us6000tyy8"
          }
        },
        "economy": {
          "status": "available",
          "provider": "us-economic-data",
          "provider_label": "Federal Reserve Economic Data (FRED)",
          "region_label": "Estados Unidos",
          "country_code": "US",
          "generated_at": "2026-10-03T02:04:09Z",
          "observed_at": "2026-10-02T00:00:00Z",
          "date": "Indicadores oficiales · 2026-10-02",
          "indicators": [
            {
              "label": "Euro (USD por EUR)",
              "value": "1,1400",
              "group": "general"
            },
            {
              "label": "Libra (USD por GBP)",
              "value": "1,3250",
              "group": "general"
            },
            {
              "label": "Yen (JPY por USD)",
              "value": "157,18",
              "group": "general"
            },
            {
              "label": "Dólar canadiense",
              "value": "1,4140",
              "group": "general"
            }
          ],
          "inflation": [
            {
              "label": "IPC mensual",
              "value": "0,32%",
              "group": "inflation"
            },
            {
              "label": "IPC anual",
              "value": "—",
              "group": "inflation"
            },
            {
              "label": "Tasa Fed",
              "value": "4%",
              "group": "inflation"
            }
          ],
          "source_url": "https://fred.stlouisfed.org/"
        }
      },
      "generator": {
        "generator_id": "sonantia-context-composer-06",
        "catalog_version": "2026-08-10-catalog-extended-04",
        "catalog_hash": "sha256:cc084f35f041392fadf131a3692c722505bc9c54f394fcb2f8ab90135011d72b",
        "group_id": "contextual",
        "selection_policy": "deterministic_factorized",
        "selected_values": [
          {
            "part_id": "opening",
            "value_id": "apertura-contextual-cloudy-0276"
          },
          {
            "part_id": "opening-family",
            "value_id": "cloudy"
          },
          {
            "part_id": "source-astronomy",
            "value_id": "fuente-astro-036-luna-altura"
          },
          {
            "part_id": "declaration",
            "value_id": "declaracion-ampliada-132"
          },
          {
            "part_id": "declaration-family",
            "value_id": "neutral"
          },
          {
            "part_id": "declaration-family",
            "value_id": "reflective"
          },
          {
            "part_id": "affirmation",
            "value_id": "consolidado-frase-005626"
          },
          {
            "part_id": "source-selection",
            "value_id": "astronomy"
          }
        ],
        "affirmation_text": "Mientras David Alexander Bijman Molina fortalece su confianza personal, también David se permite descansar sin sentir culpa."
      },
      "content_hash": "sha256:18226e4bbaf87c7837f3fbae1834f7bbf635ec78d24acfbc0eaea07eee15698e"
    }
  ]
}
