{
  "network_id": "sonantia-network",
  "protocol_version": "1.0",
  "network_epoch": "SN1-2026-08-02",
  "document_type": "daily-archive",
  "origin_node_id": "N02",
  "date": "2026-10-30",
  "message_count": 1,
  "first_sequence": 761,
  "last_sequence": 761,
  "messages": [
    {
      "network_id": "sonantia-network",
      "protocol_version": "1.0",
      "network_epoch": "SN1-2026-08-02",
      "message_id": "SN1-N02-2026-10-30T01-07-22Z-000761",
      "origin_node_id": "N02",
      "sequence": 761,
      "created_at": "2026-10-30T01:07:22Z",
      "visibility": "public",
      "language": "es",
      "text": "Cuando termina la consulta, comienza otra composición en Nueva York. El contexto económico del nodo recoge Yen (JPY por USD) con un valor de 156,87. La lectura del entorno conduce ahora a recordar que hoy, David Alexander Bijman Molina elige cuidar su bienestar mientras persigue sus metas y abre el camino para reconocimiento por parte de quienes valoran su trabajo.",
      "context": {
        "location": {
          "zone": "north-america",
          "country": "Estados Unidos",
          "country_code": "US",
          "city": "Nueva York",
          "timezone": "America/New_York",
          "latitude": 40.7789,
          "longitude": -73.9692,
          "elevation_m": 43.0
        },
        "weather": {
          "status": "available",
          "provider": "open-meteo-current",
          "requested_at": "2026-10-30T01:07:22Z",
          "observed_at": "2026-10-30T01:00:00Z",
          "condition_provider": "open-meteo-current",
          "condition_observed_at": "2026-10-30T01:00:00Z",
          "measurement_source_count": 1,
          "measurement_source_codes": [
            "open-meteo-current"
          ],
          "location": {
            "latitude": 40.78858,
            "longitude": -73.9661
          },
          "data": {
            "temperature_c": 14.8,
            "relative_humidity_percent": 81.0,
            "precipitation_mm": 0.0,
            "pressure_hpa": 1018.4,
            "wind_speed_kmh": 10.2,
            "solar_radiation_wm2": 0.0,
            "condition_code": 0
          }
        },
        "astronomy": {
          "status": "available",
          "generated_at": "2026-10-30T01:07:22Z",
          "observer": {
            "code": "coord@399",
            "name": "Nueva York · coordenadas N02",
            "longitude_deg": -73.9692,
            "latitude_deg": 40.7789,
            "elevation_km": 0.043,
            "timezone": "America/New_York"
          },
          "target_count": 21,
          "available_target_count": 21,
          "reference_target": {
            "name": "Sol",
            "kind": "estrella",
            "icon": "☀️",
            "azimuth_deg": 284.494624,
            "elevation_deg": -36.604008,
            "visibility": "bajo el horizonte"
          }
        },
        "geology": {
          "status": "available",
          "provider": "usgs-earthquakes",
          "provider_label": "U.S. Geological Survey (USGS)",
          "region_label": "Región geológica cercana a N02",
          "country_code": "US",
          "generated_at": "2026-10-30T01:07:22Z",
          "observed_at": "2026-10-27T10:46:57Z",
          "window_hours": 168,
          "search_stage": "regional-7d",
          "count": 1,
          "source_url": "https://earthquake.usgs.gov/fdsnws/event/1/query?format=geojson&starttime=2026-10-23T01%3A07%3A22Z&endtime=2026-10-30T01%3A07%3A22Z&eventtype=earthquake&orderby=time&limit=200&latitude=40.7789&longitude=-73.9692&maxradiuskm=550",
          "recent_event": {
            "event_id": "us7000ttg8",
            "occurred_at": "2026-10-27T10:46:57Z",
            "local_time": "2026-10-27 06:46:57",
            "location": "4 km NNE of Bernardsville, New Jersey",
            "magnitude": 1.1,
            "magnitude_text": "1.1",
            "depth_km": 5.0,
            "depth": "5.0 km",
            "latitude": 40.7543,
            "longitude": -74.5385,
            "url": "https://earthquake.usgs.gov/earthquakes/eventpage/us7000ttg8"
          }
        },
        "economy": {
          "status": "available",
          "provider": "us-economic-data",
          "provider_label": "Federal Reserve Economic Data (FRED)",
          "region_label": "Estados Unidos",
          "country_code": "US",
          "generated_at": "2026-10-30T01:07:22Z",
          "observed_at": "2026-10-29T00:00:00Z",
          "date": "Indicadores oficiales · 2026-10-29",
          "indicators": [
            {
              "label": "Euro (USD por EUR)",
              "value": "1,1199",
              "group": "general"
            },
            {
              "label": "Libra (USD por GBP)",
              "value": "1,3375",
              "group": "general"
            },
            {
              "label": "Yen (JPY por USD)",
              "value": "156,87",
              "group": "general"
            },
            {
              "label": "Dólar canadiense",
              "value": "1,3993",
              "group": "general"
            }
          ],
          "inflation": [
            {
              "label": "IPC mensual",
              "value": "0,59%",
              "group": "inflation"
            },
            {
              "label": "IPC anual",
              "value": "—",
              "group": "inflation"
            },
            {
              "label": "Tasa Fed",
              "value": "4%",
              "group": "inflation"
            }
          ],
          "source_url": "https://fred.stlouisfed.org/"
        }
      },
      "generator": {
        "generator_id": "sonantia-context-composer-06",
        "catalog_version": "2026-08-10-catalog-extended-04",
        "catalog_hash": "sha256:cc084f35f041392fadf131a3692c722505bc9c54f394fcb2f8ab90135011d72b",
        "group_id": "contextual",
        "selection_policy": "deterministic_factorized",
        "selected_values": [
          {
            "part_id": "opening",
            "value_id": "apertura-ampliada-359"
          },
          {
            "part_id": "opening-family",
            "value_id": "general"
          },
          {
            "part_id": "source-economy",
            "value_id": "fuente-economia-029-indicador-3"
          },
          {
            "part_id": "declaration",
            "value_id": "declaracion-ampliada-205"
          },
          {
            "part_id": "declaration-family",
            "value_id": "bridge"
          },
          {
            "part_id": "declaration-family",
            "value_id": "neutral"
          },
          {
            "part_id": "declaration-family",
            "value_id": "observation"
          },
          {
            "part_id": "declaration-family",
            "value_id": "present-moment"
          },
          {
            "part_id": "affirmation",
            "value_id": "consolidado-frase-006500"
          },
          {
            "part_id": "source-selection",
            "value_id": "economy"
          }
        ],
        "affirmation_text": "Hoy, David Alexander Bijman Molina elige cuidar su bienestar mientras persigue sus metas y abre el camino para reconocimiento por parte de quienes valoran su trabajo."
      },
      "content_hash": "sha256:806841da73d1663d2832caa51c2ead06a05ed4c8eeae07c7f762f5361e27fd5a"
    }
  ]
}
